{
 "schema_version": "1.0",
 "meta": {
  "app_name": "ShopNest: Shop & Delivery",
  "app_short": "ShopNest",
  "app_id": "1690042117",
  "run_date": "2026-10-20",
  "period_start": "2026-07-18",
  "period_end": "2026-10-19",
  "countries": [
   "US",
   "GB",
   "DE",
   "FR",
   "CA",
   "AU"
  ],
  "n_reviews": 2978,
  "n_statements": 6912,
  "n_statements_kept": 6904,
  "mean_stars": 3.25,
  "kappa": 0.81,
  "repetition_threshold": 15,
  "languages": [
   "English",
   "German",
   "French"
  ],
  "second_pass_n": 691,
  "notice": "**Sample report.** ShopNest is a made-up app. Every number, quote and review ID on this page is invented to show what the agent produces."
 },
 "summary": [
  "The most raised problem is **Apple Pay payment fails at checkout**: 8.0% of reviews (95% CI 6.7 to 9.4%). Reviews that raise it average 2.1 fewer stars than reviews that don't.",
  "**Logged out after app update** rose from 1.8% of reviews in earlier weeks to 9.0% in the last four (compared within countries, adjusted p < 0.001), starting the week version 8.5 was released. The other top problems did not change significantly.",
  "The most raised strength is **fast, simple checkout** (10.0%). Checkout holds the top strength and two of the top three problems.",
  "13.9% of 4 and 5 star reviews still report at least one problem (95% CI 12.3 to 15.7%).",
  "Along the journey, **sign in** and **help chat** are the most negative stages (net sentiment −71 each); **finding groceries** is the most positive (+30).",
  "Country differences are negligible for every problem (Cramér's V under 0.1) except **German text cut off or wrongly translated**, raised only in Germany, by 8.2% of its reviews."
 ],
 "about": {
  "description": "Groceries and household essentials delivered in under an hour. Sign in with one tap, browse thousands of products, save with promo codes, pay with Apple Pay, track your driver live and reorder favourites in one tap. Questions? Our in-app help chat is open 24/7.",
  "description_source": "App Store description, first paragraph",
  "developer": "ShopNest Ltd.",
  "category": "Shopping",
  "price": "Free, no in-app purchases",
  "current_version": "8.5",
  "current_version_date": "2026-10-03",
  "store_rating": 4.2,
  "store_rating_country": "US",
  "store_rating_count": 412000,
  "languages_label": "English, German, French and 4 more",
  "features": [
   "One-tap sign in",
   "Promo codes",
   "Apple Pay",
   "Live driver tracking",
   "One-tap reorder",
   "24/7 help chat"
  ],
  "versions": [
   {
    "version": "8.5",
    "date": "2026-10-03",
    "notes": "A new, faster sign-in. Bug fixes and performance improvements."
   },
   {
    "version": "8.4",
    "date": "2026-08-28",
    "notes": "New checkout with saved cards and Apple Pay improvements."
   },
   {
    "version": "8.3",
    "date": "2026-07-09",
    "notes": "Faster product pages. Bug fixes."
   }
  ]
 },
 "countries": [
  {
   "code": "US",
   "name": "United States",
   "ratings": 412000,
   "weight": 45.5,
   "n": 498,
   "window": "Oct 6 to Oct 19",
   "days": 14,
   "lang": "English"
  },
  {
   "code": "GB",
   "name": "United Kingdom",
   "ratings": 168000,
   "weight": 18.6,
   "n": 499,
   "window": "Sep 12 to Oct 19",
   "days": 38,
   "lang": "English"
  },
  {
   "code": "DE",
   "name": "Germany",
   "ratings": 121000,
   "weight": 13.4,
   "n": 497,
   "window": "Aug 30 to Oct 19",
   "days": 51,
   "lang": "German"
  },
  {
   "code": "FR",
   "name": "France",
   "ratings": 88000,
   "weight": 9.7,
   "n": 500,
   "window": "Aug 21 to Oct 19",
   "days": 60,
   "lang": "French"
  },
  {
   "code": "CA",
   "name": "Canada",
   "ratings": 64000,
   "weight": 7.1,
   "n": 498,
   "window": "Aug 2 to Oct 19",
   "days": 79,
   "lang": "English, French"
  },
  {
   "code": "AU",
   "name": "Australia",
   "ratings": 52000,
   "weight": 5.7,
   "n": 486,
   "window": "Jul 18 to Oct 19",
   "days": 94,
   "lang": "English"
  }
 ],
 "country_selection": {
  "candidates": 50,
  "coverage": 83.5,
  "target": 80
 },
 "mix": {
  "5": [
   22,
   128,
   1010,
   68
  ],
  "4": [
   25,
   44,
   251,
   25
  ],
  "3": [
   92,
   88,
   49,
   18
  ],
  "2": [
   214,
   41,
   6,
   10
  ],
  "1": [
   822,
   38,
   3,
   24
  ]
 },
 "sentiment": {
  "overall": {
   "negative": {
    "n": 3189,
    "p": 46.2,
    "lo": 45.0,
    "hi": 47.4
   },
   "mixed": {
    "n": 345,
    "p": 5.0,
    "lo": 4.5,
    "hi": 5.5
   },
   "neutral": {
    "n": 875,
    "p": 12.7,
    "lo": 11.9,
    "hi": 13.5
   },
   "positive": {
    "n": 2495,
    "p": 36.1,
    "lo": 35.0,
    "hi": 37.3
   }
  },
  "categories": [
   {
    "name": "Payments",
    "neg": 880,
    "mixed": 70,
    "neutral": 110,
    "pos": 660,
    "total": 1720,
    "net": -12.8
   },
   {
    "name": "Orders and delivery",
    "neg": 470,
    "mixed": 55,
    "neutral": 135,
    "pos": 580,
    "total": 1240,
    "net": 8.9
   },
   {
    "name": "Sign in and account",
    "neg": 470,
    "mixed": 25,
    "neutral": 75,
    "pos": 40,
    "total": 610,
    "net": -70.5
   },
   {
    "name": "Browse and search",
    "neg": 190,
    "mixed": 25,
    "neutral": 55,
    "pos": 190,
    "total": 460,
    "net": 0.0
   },
   {
    "name": "Value and pricing",
    "neg": 110,
    "mixed": 35,
    "neutral": 60,
    "pos": 375,
    "total": 580,
    "net": 45.7
   },
   {
    "name": "Visual design",
    "neg": 75,
    "mixed": 35,
    "neutral": 52,
    "pos": 430,
    "total": 592,
    "net": 60.0
   },
   {
    "name": "Support",
    "neg": 250,
    "mixed": 15,
    "neutral": 35,
    "pos": 30,
    "total": 330,
    "net": -66.7
   },
   {
    "name": "Performance",
    "neg": 230,
    "mixed": 10,
    "neutral": 30,
    "pos": 30,
    "total": 300,
    "net": -66.7
   },
   {
    "name": "Notifications",
    "neg": 140,
    "mixed": 10,
    "neutral": 30,
    "pos": 30,
    "total": 210,
    "net": -52.4
   },
   {
    "name": "Content and copy",
    "neg": 120,
    "mixed": 15,
    "neutral": 25,
    "pos": 30,
    "total": 190,
    "net": -47.4
   },
   {
    "name": "Settings",
    "neg": 40,
    "mixed": 10,
    "neutral": 70,
    "pos": 40,
    "total": 160,
    "net": 0.0
   }
  ]
 },
 "issues": [
  {
   "id": "pay-applepay",
   "name": "Apple Pay payment fails at checkout",
   "category": "Payments",
   "type": "Bug",
   "definition": "Payment with Apple Pay fails, freezes, or is declined inside the app.",
   "counts": [
    52,
    38,
    21,
    24,
    34,
    27
   ],
   "n": 196,
   "wshare": 8.0,
   "wci": [
    6.66,
    9.35
   ],
   "per_country": [
    10.44,
    7.62,
    4.23,
    4.8,
    6.83,
    5.56
   ],
   "cv": 34.5,
   "chi2": 20.9,
   "p": 0.000851,
   "cramer": 0.084,
   "stars": {
    "mean": 1.31,
    "sd": 0.62,
    "median": 1,
    "mode": 1,
    "cv": 47.3
   },
   "gap": -2.08,
   "gap_ci": [
    -2.19,
    -1.97
   ],
   "cohen_d": -1.6,
   "severity": [
    158,
    52,
    19,
    3
   ],
   "kappa": 0.88,
   "short_name": "Apple Pay fails",
   "stage": "Checkout",
   "team": {
    "primary": "Payments and billing",
    "secondary": [
     "Backend and platform engineering",
     "Mobile engineering"
    ]
   },
   "n_low": 186
  },
  {
   "id": "acct-logout",
   "name": "Logged out after app update",
   "category": "Sign in and account",
   "type": "Bug",
   "definition": "The app signs the reviewer out after an update and asks them to sign in again.",
   "counts": [
    44,
    31,
    29,
    26,
    30,
    22
   ],
   "n": 182,
   "wshare": 7.15,
   "wci": [
    5.89,
    8.41
   ],
   "per_country": [
    8.84,
    6.21,
    5.84,
    5.2,
    6.02,
    4.53
   ],
   "cv": 24.1,
   "chi2": 9.4,
   "p": 0.0951,
   "cramer": 0.056,
   "stars": {
    "mean": 1.64,
    "sd": 0.88,
    "median": 1,
    "mode": 1,
    "cv": 53.7
   },
   "gap": -1.72,
   "gap_ci": [
    -1.86,
    -1.58
   ],
   "cohen_d": -1.25,
   "severity": [
    71,
    88,
    52,
    9
   ],
   "kappa": 0.91,
   "short_name": "Logged out after update",
   "stage": "Sign in",
   "team": {
    "primary": "Mobile engineering",
    "secondary": [
     "QA and release"
    ]
   },
   "n_low": 158
  },
  {
   "id": "pay-fee",
   "name": "Delivery fee shown only at last step",
   "category": "Payments",
   "type": "Complaint",
   "definition": "The delivery fee first appears on the final checkout screen.",
   "counts": [
    31,
    22,
    24,
    13,
    19,
    14
   ],
   "n": 123,
   "wshare": 4.99,
   "wci": [
    3.91,
    6.06
   ],
   "per_country": [
    6.22,
    4.41,
    4.83,
    2.6,
    3.82,
    2.88
   ],
   "cv": 32.4,
   "chi2": 11.2,
   "p": 0.0471,
   "cramer": 0.061,
   "stars": {
    "mean": 2.12,
    "sd": 1.05,
    "median": 2,
    "mode": 1,
    "cv": 49.5
   },
   "gap": -1.18,
   "gap_ci": [
    -1.38,
    -0.99
   ],
   "cohen_d": -0.83,
   "severity": [
    9,
    61,
    58,
    8
   ],
   "kappa": 0.83,
   "short_name": "Late delivery fee",
   "stage": "Checkout",
   "team": {
    "primary": "UX design",
    "secondary": [
     "Product management"
    ]
   },
   "n_low": 88
  },
  {
   "id": "ord-tracking",
   "name": "Order tracking map stops updating",
   "category": "Orders and delivery",
   "type": "Bug",
   "definition": "The live map or order status freezes and no longer shows where the order is.",
   "counts": [
    29,
    17,
    12,
    15,
    16,
    9
   ],
   "n": 98,
   "wshare": 4.23,
   "wci": [
    3.21,
    5.25
   ],
   "per_country": [
    5.82,
    3.41,
    2.41,
    3.0,
    3.21,
    1.85
   ],
   "cv": 41.6,
   "chi2": 14.6,
   "p": 0.0124,
   "cramer": 0.07,
   "stars": {
    "mean": 1.93,
    "sd": 0.97,
    "median": 2,
    "mode": 1,
    "cv": 50.3
   },
   "gap": -1.37,
   "gap_ci": [
    -1.57,
    -1.17
   ],
   "cohen_d": -0.98,
   "severity": [
    22,
    51,
    33,
    4
   ],
   "kappa": 0.8,
   "short_name": "Tracking stops",
   "stage": "Live delivery tracking",
   "team": {